hs_code,hs_description,period_value,ytd_value
9010,"Photographic (including cinematographic) laboratory apparatus and equipment, n.e.c. in chapter 90; negatoscopes; projection screens",3817.0,3817.0
9017,Sugars and sugar confectionery,171256.0,171256.0
9018,"Instruments and appliances used in medical, surgical, dental or veterinary sciences, including scintigraphic apparatus, other electro-medical apparatus and sight testing instruments",270536.4,270536.4
9026,"Instruments, apparatus for measuring or checking the flow, level, pressure of liquids, gases (e.g. flow meters, heat meters etc), not instruments and apparatus of heading no. 9014, 9015, 9028 or 9032",4833.0,4833.0
9028,"Gas, liquid or electricity supply or production meters, including calibrating meters therefor",18475.0,18475.0
9030,"Instruments, apparatus for measuring, checking electrical quantities not meters of heading no. 9028; instruments, apparatus for measuring or detecting alpha, beta, gamma, x-ray, cosmic and other radia",11038.91,11038.91
9031,"Measuring or checking instruments, appliances and machines, n.e.c. or included in this chapter; profile projectors",5.0,5.0
9105,"Clocks, other, n.e.c.",13.0,13.0
9112,Clock cases and cases of a similar type for other goods of this chapter and parts thereof,62771.9,62771.9
9209,"Musical instrument parts (for example, mechanisms for musical boxes) and accessories (for example, cards, discs and rolls for mechanical instruments); metronomes, tuning forks and pitch pipes",3253.0,3253.0
9401,"Seats (not those of heading no. 9402), whether or not convertible into beds and parts thereof",287052.58,287052.58
9403,"Furniture and parts thereof, n.e.c. in chapter 94",1939257.42,1939257.42
9404,"Mattress supports; articles of bedding (e.g. mattresses, quilts, eiderdowns, cushions pouffes and pillows), fitted with springs or stuffed, whether or not covered",220638.27999999997,220638.27999999997
9405,"Lamps, light fittings; including searchlights, spotlights and parts thereof, n.e.c.; illuminated signs, name-plates and the like, having permanently fixed light source and parts thereof n.e.c. or incl",517002.44999999995,517002.44999999995
9406,Buildings; prefabricated,2717733.78,2717733.78
9503,"Tricycles, scooters, pedal cars and similar wheeled toys; dolls' carriages; dolls; other toys; reduced-size (scale) models and similar recreational models, working or not; puzzles of all kinds",95353.29,95353.29
9504,"Video game consoles and machines, articles for funfair, table or parlour games, including pintables, billiards, special tables for casino games and automatic bowling alley equipment",45000.0,45000.0
9505,"Festive, carnival or other entertainment articles, including conjuring tricks and novelty jokes",60.0,60.0
9506,"Gymnastics, athletics, other sports (including table tennis) or outdoor games equipment, n.e.c. in this chapter, swimming pools and paddling pools",152480.14,152480.14
9507,"Fishing rods, fish-hooks and other line fishing tackle; fish landing nets and the like; decoy birds (not those of heading no. 9208 or 9705) and similar hunting or shooting requisites",0.0,0.0
9603,"Brooms, brushes (including parts of machines), hand operated floor sweepers, mops and feather dusters; knots and tufts for broom or brush making; paint pads and rollers; squeegees",624273.2,624273.2
9605,"Travel sets; for personal toilet, sewing, shoe or clothes cleaning",3363.0,3363.0
9608,"Pens; ball-point, felt tipped, other porous tipped pens; fountain pens, stylograph pens duplicating stylos, propelling or sliding pencils; parts of the foregoing, excluding those of heading no. 9609",183410.1,183410.1
9609,"Pencils (not of heading no. 9608), crayons, pencil leads, pastels, drawing charcoals, writing or drawing chalks and tailors' chalks",25876.76,25876.76
9611,"Stamps; date, numbering, sealing stamps and the like (including devices for printing or embossing labels), designed for operating by hand; hand operated composing sticks and printing sets",61306.0,61306.0
9613,"Cigarette lighters and other lighters, whether or not mechanical or electrical and parts thereof other than flints and wicks",46740.0,46740.0
9615,"Combs, hair-slides and similar; hairpins, curling pins, curling grips and hair curlers and the like, other than those of heading no. 8516 and parts thereof",374026.59,374026.59
9617,"Vacuum flasks and other vacuum vessels, complete with cases; parts thereof other than glass inners",343531.74000000005,343531.74000000005
9619,"Sanitary towels (pads) and tampons, napkins and napkin liners for babies and similar articles, of any material",7144028.300000001,7144028.300000001
9705,Animal originated products; not elsewhere specified or included,11227.0,11227.0
9999,Commodities not specified according to kind,283759913.98999995,283759913.98999995
