hs_code,hs_description,period_value,ytd_value
0202,Meat of bovine animals; frozen,15558.21,15558.21
0203,"Meat of swine; fresh, chilled or frozen",17422509.45,17422509.45
0207,"Meat and edible offal of poultry; of the poultry of heading no. 0105, (i.e. fowls of the species Gallus domesticus), fresh, chilled or frozen",87176687.19999999,87176687.19999999
0208,"Meat and edible meat offal, n.e.c. in chapter 2; fresh, chilled or frozen",223871.56,223871.56
0302,"Fish; fresh or chilled, excluding fish fillets and other fish meat of heading 0304",8305771.65,8305771.65
0305,"Fish, dried, salted or in brine; smoked fish, whether or not cooked before or during the smoking process; flours, meals and pellets of fish, fit for human consumption",995080.0,995080.0
0306,"Crustaceans; in shell or not, live, fresh, chilled, frozen, dried, salted or in brine; smoked, cooked or not before or during smoking; in shell, steamed or boiled, whether or not chilled, frozen, drie",758502.94,758502.94
0402,Milk and cream; concentrated or containing added sugar or other sweetening matter,61040296.599999994,61040296.599999994
0403,"Fish and crustaceans, molluscs and other aquatic invertebrates",52826.0,52826.0
0404,"Whey and products consisting of natural milk constituents; whether or not containing added sugar or other sweetening matter, not elsewhere specified or included",51923.04,51923.04
0405,Butter and other fats and oils derived from milk; dairy spreads,1052717.29,1052717.29
0406,Cheese and curd,1235635.01,1235635.01
0602,"Plants, live; n.e.c. in heading no. 0601, (including their roots) cuttings and slips; mushroom spawn",52.0,52.0
0603,"Flowers; cut flowers and flower buds of a kind suitable for bouquets or for ornamental purposes, fresh, dried, dyed, bleached, impregnated or otherwise prepared",14909.0,14909.0
0701,Potatoes; fresh or chilled,511455.2,511455.2
0702,Meat and edible meat offal,185598.08000000002,185598.08000000002
0703,"Onions, shallots, garlic, leeks and other alliaceous vegetables; fresh or chilled",25044097.89,25044097.89
0712,"Vegetables, dried; whole, cut, sliced, broken or in powder, but not further prepared",23428.0,23428.0
0713,"Vegetables, leguminous; shelled, whether or not skinned or split, dried",4305889.58,4305889.58
0806,Grapes; fresh or dried,11634.19,11634.19
0810,"Fruit, fresh; n.e.c. in chapter 08",13341.9,13341.9
0813,"Fruit, dried, other than that of heading no. 0801 to 0806; mixtures of nuts or dried fruits of this chapter",1882.0,1882.0
0901,"Coffee, whether or not roasted or decaffeinated; husks and skins; coffee substitutes containing coffee in any proportion",4161.4,4161.4
0904,Pepper of the genus piper; dried or crushed or ground fruits of the genus capsicum or of the genus pimenta,41164.0,41164.0
0906,Cinnamon and cinnamon-tree flowers,352999.0,352999.0
0907,"Cloves (whole fruit, cloves and stems)",257243.40000000002,257243.40000000002
1001,Wheat and meslin,220742705.3,220742705.3
1005,Maize (corn),1753664.1,1753664.1
1006,Rice,477106042.72999996,477106042.72999996
1007,Grain sorghum,451182.02,451182.02
1101,Wheat or meslin flour,507200.0,507200.0
1102,Cereal flours; other than of wheat or meslin,1660687.24,1660687.24
1103,Cereal groats; meal and pellets,2673637.16,2673637.16
1107,Malt; whether or not roasted,8294597.0200000005,8294597.0200000005
1108,Starches; inulin,3461732.39,3461732.39
1208,Flours and meals of oil seeds or oleaginous fruits; other than those of mustard,208328.01,208328.01
1209,"Seeds, fruit and spores; of a kind used for sowing",209924.97,209924.97
1301,"Lac; natural gums, resins, gum-resins and oleoresins (for example, balsams)",44107.0,44107.0
1507,"Soya-bean oil and its fractions; whether or not refined, but not chemically modified",7288109.14,7288109.14
1509,"Olive oil and its fractions; whether or not refined, but not chemically modified",78300.44,78300.44
1511,"Palm oil and its fractions; whether or not refined, but not chemically modified",93262873.0,93262873.0
1515,"Fixed vegetable fats and oils (including jojoba oil) and their fractions, whether or not refined; but not chemically modified",15717485.59,15717485.59
1516,"Animal or vegetable fats and oils and their fractions; partly or wholly hydrogenated, inter-esterified, re-esterified or elaidinised, whether or not refined, but not further prepared",14246618.399999999,14246618.399999999
1517,"Margarine; edible mixtures or preparations of animal or vegetable fats or oils or of fractions of different fats or oils of this chapter, other than edible fats or oils of heading no. 1516",2353572.1,2353572.1
1601,"Sausages and similar products of meat, meat offal or blood; food preparations based on these products",10258308.27,10258308.27
1602,"Prepared or preserved meat, meat offal or blood",57834.0,57834.0
1604,Prepared or preserved fish; caviar and caviar substitutes prepared from fish eggs,11390344.0,11390344.0
1701,"Cane or beet sugar and chemically pure sucrose, in solid form",175483153.19,175483153.19
1703,Molasses; resulting from the extraction or refining of sugar,783751.2,783751.2
1704,"Sugar confectionery (including white chocolate), not containing cocoa",6659188.100000001,6659188.100000001
1805,"Cocoa; powder, not containing added sugar or other sweetening matter",20190.0,20190.0
1806,Chocolate and other food preparations containing cocoa,35988.96,35988.96
1901,"Malt extract; flour/groats/meal/starch/malt extract products, no cocoa (or less than 40% by weight) and food preparations of goods of headings 04.01 to 04.04, no cocoa (or less than 5% by weight), wei",1606829.38,1606829.38
1902,"Pasta; whether or not cooked or stuffed with meat or other substance, or otherwise prepared, egg spaghetti, macaroni, noodles, lasagne, gnocchi, ravioli, cannelloni; couscous, whether or not prepared",1183400.97,1183400.97
1905,"Bread, pastry, cakes, biscuits, other bakers' wares, whether or not containing cocoa; communion wafers, empty cachets suitable for pharmaceutical use, sealing wafers, rice paper and similar products",10348540.66,10348540.66
2002,Tomatoes; prepared or preserved otherwise than by vinegar or acetic acid,4274209.48,4274209.48
2005,"Vegetables preparations n.e.c.; prepared or preserved otherwise than by vinegar or acetic acid, not frozen, other than products of heading no. 2006",489725.57,489725.57
2007,"Jams, fruit jellies, marmalades, fruit or nut puree and fruit or nut pastes, being cooked preparations; whether or not containing added sugar or other sweetening matter",19680.0,19680.0
2008,"Fruit, nuts and other edible parts of plants; prepared or preserved in ways n.e.c., whether or not containing added sugar or other sweetening matter or spirit, not elsewhere specified or included",30862.9,30862.9
2009,"Fruit juices (including grape must) and vegetable juices, unfermented, not containing added spirit; whether or not containing added sugar or other sweetening matter",1341713.15,1341713.15
2101,"Extracts, essences, concentrates of coffee, tea or mate; preparations with a basis of these products or with a basis of coffee, tea or mate; roasted chicory and other roasted coffee substitutes and ex",48596.4,48596.4
2102,"Yeasts (active or inactive); other single-cell micro-organisms, dead (but not including vaccines of heading no. 3002); prepared baking powders",461978.02,461978.02
2103,"Sauces and preparations therefor; mixed condiments and mixed seasonings, mustard flour and meal and prepared mustard",887927.9800000001,887927.9800000001
2104,Soups and broths and preparations therefor; homogenised composite food preparations,1931730.76,1931730.76
2106,Food preparations not elsewhere specified or included,67238110.17999999,67238110.17999999
2201,"Waters, including natural or artificial mineral waters and aerated waters, not containing added sugar or other sweetening matter nor flavoured; ice and snow",177234.35,177234.35
2202,"Waters, including mineral and aerated waters, containing added sugar or sweetening matter, flavoured; other non-alcoholic beverages, not including fruit or vegetable juices of heading no. 2009",2177841.21,2177841.21
2203,Beer made from malt,13422617.28,13422617.28
2205,"Vermouth and other wine of fresh grapes, flavoured with plants or aromatic substances",4724457.58,4724457.58
2208,"Ethyl alcohol, undenatured; of an alcoholic strength by volume of less than 80% volume; spirits, liqueurs and other spirituous beverages",3550099.4600000004,3550099.4600000004
2309,Preparations of a kind used in animal feeding,807381.8300000001,807381.8300000001
2401,"Tobacco, unmanufactured; tobacco refuse",684675.49,684675.49
2402,"Cigars, cheroots, cigarillos and cigarettes; of tobacco or of tobacco substitutes",478510.13,478510.13
2501,Salt (including table salt and denatured salt); pure sodium chloride whether or not in aqueous solution; sea water,14458927.11,14458927.11
2507,Kaolin and other kaolinic clays; whether or not calcined,337867.64,337867.64
2509,Chalk,419161.0,419161.0
2523,"Portland cement, aluminous cement (ciment fondu), slag cement, supersulphate cement and similar hydraulic cements, whether or not coloured or in the form of clinkers",1053492377.01,1053492377.01
2706,"Tar distilled from coal, from lignite, peat and other mineral tars, whether or not dehydrated or partially distilled; including reconstituted tars",18648.4,18648.4
2709,Petroleum oils and oils obtained from bituminous minerals; crude,41237167.78,41237167.78
2710,Cereals,4572.0,4572.0
2710,"Petroleum oils and oils from bituminous minerals, not crude; preparations n.e.c, containing by weight 70% or more of petroleum oils or oils from bituminous minerals; these being the basic constituents",669831496.5,669831496.5
2711,Petroleum gases and other gaseous hydrocarbons,61594505.01,61594505.01
2712,"Petroleum jelly; paraffin wax, micro-crystalline petroleum wax, slack wax, ozokerite, lignite wax, peat wax, other mineral waxes, similar products obtained by synthesis, other processes; coloured or n",202118.4,202118.4
2714,"Bitumen and asphalt, natural; bituminous or oil shale and tar sands; asphaltites and asphaltic rocks",612985.96,612985.96
2804,"Hydrogen, rare gases and other non-metals",495638.86,495638.86
2805,"Alkali or alkaline-earth metals; rare-earth metals, scandium and yttrium, whether or not intermixed or interalloyed; mercury",55739.479999999996,55739.479999999996
2806,Hydrogen chloride (hydrochloric acid); chlorosulphuric acid,203775.77000000002,203775.77000000002
2807,Sulphuric acid; oleum,130160.5,130160.5
2809,Diphosphorus pentoxide; phosphoric acid and polyphosphoric acids,54440.0,54440.0
2811,Inorganic acids and other inorganic oxygen compounds of non-metals; n.e.c. in heading no. 2806 to 2810,972871.0,972871.0
2814,Ammonia; anhydrous or in aqueous solution,37712.9,37712.9
2815,Sodium hydroxide (caustic soda); potassium hydroxide (caustic potash) peroxides of sodium or potassium,2510240.0,2510240.0
2823,Titanium oxides,372340.0,372340.0
2827,Chlorides; chloride oxides and chloride hydroxides; bromides and bromide oxides; iodides and iodide oxides,139938.16,139938.16
2828,Hypochlorites; commercial calcium hypochlorite; chlorites; hypobromites,85163.5,85163.5
2833,Sulphates; alums; peroxosulphates (persulphates),5967394.6,5967394.6
2835,"Phosphinates (hypophosphites), phosphonates (phosphites), and phosphates; and polyphosphates, whether or not chemically defined",573793.1,573793.1
2836,Carbonates; peroxocarbonates (percarbonates); commercial ammonium carbonate containing ammonium carbamate,2203384.37,2203384.37
2837,"Cyanides, cyanide oxides and complex cyanides",435645.6,435645.6
2839,Silicates; commercial alkali metal silicates,1511748.0,1511748.0
2842,"Salts of inorganic acids or peroxoacids, n.e.c. including aluminosilicates whether or not chemically defined, but excluding azides",3508089.1799999997,3508089.1799999997
2847,Hydrogen peroxide; whether or not solidified with urea,10590.0,10590.0
2849,"Carbides, whether or not chemically defined",322091.12,322091.12
2901,Acyclic hydrocarbons,14820.0,14820.0
2902,Cyclic hydrocarbons,39663.0,39663.0
2903,Halogenated derivatives of hydrocarbons,87310.38,87310.38
2905,"Acyclic alcohols and their halogenated, sulphonated, nitrated or nitrosated derivatives",5266542.36,5266542.36
2912,"Aldehydes, whether or not with other oxygen function; cyclic polymers of aldehydes; paraformaldehyde",17687.2,17687.2
2915,"Acids; saturated acyclic monocarboxylic acids and their anhydrides, halides, peroxides and peroxyacids; their halogenated, sulphonated, nitrated or nitrosated derivatives",422157.0,422157.0
2916,"Acids; unsaturated acyclic monocarboxylic, cyclic monocarboxylic, their anhydrides, halides, peroxides and peroxyacids; their halogenated, sulphonated, nitrated or nitrosated derivatives",111188.8,111188.8
2918,"Acids; carboxylic acid with additional oxygen function and their anhydrides, halides, peroxides, peroxyacids; their halogenated, sulphonated, nitrated or nitrosated derivatives",2919351.0,2919351.0
2921,Amine-function compounds,25360.0,25360.0
2933,Heterocyclic compounds with nitrogen hetero-atom(s) only,17234.7,17234.7
2936,"Provitamins, vitamins; natural or reproduced by synthesis (including natural concentrates) derivatives thereof used as vitamins, and intermixtures of the fore-going, whether or not in any solvent",110616.6,110616.6
2940,"Sugars, chemically pure, other than sucrose, lactose, maltose, glucose and fructose; sugar ethers, sugar acetals and sugar esters, and their salts, other than the products of heading 29.37, 29.38, or ",46235.46,46235.46
2941,Antibiotics,14662.81,14662.81
2942,Organic compounds; n.e.c. in chapter 29,27440.0,27440.0
3002,"Human blood; animal blood for therapeutic, prophylactic or diagnostic uses; antisera, other blood fractions, immunological products, modified or obtained by biotechnological processes; vaccines, toxin",146683.96,146683.96
3002,Meat and edible meat offal,0.0,0.0
3003,"Medicaments; (not goods of heading no. 3002, 3005 or 3006) of two or more constituents mixed together for therapeutic or prophylactic use not in measured doses or in forms or packings for retail sale",824165.28,824165.28
3004,"Medicaments; (not goods of heading no. 3002, 3005 or 3006) consisting of mixed or unmixed products for therapeutic or prophylactic use, put up in measured doses (incl. those in the form of transdermal",1213711.37,1213711.37
3005,"Wadding, gauze, bandages (dressings, adhesive plasters, poultices), impregnated or coated with pharmaceutical substances or in forms or packings for retail sale, for medical, surgical or veterinary us",78646.5,78646.5
3006,Pharmaceutical goods,2830336.38,2830336.38
3101,"Fertilizers; animal or vegetable, whether or not mixed together or chemically treated; fertilizers produced by the mixing or chemical treatment of animal or vegetable products",290000.0,290000.0
3203,"Colouring matter of vegetable or animal origin (including dyeing extracts, not animal black); whether or not chemically defined; preparations based on colouring matter of vegetable or animal origin",291879.95999999996,291879.95999999996
3204,Synthetic organic colouring matter and preparations based thereon; synthetic organic products used as fluorescent brightening agents or as luminophores; whether or not chemically defined,8451698.1,8451698.1
3206,"Colouring matter and preparations thereof n.e.c. in heading no. 3203, 3204, 3205; inorganic products, kind used as luminophores whether or not chemically defined",83332.0,83332.0
3207,"Pigments, prepared; opacifiers, colours, vitrifiable enamels, glazes, engobes (slips), liquid lustres etc as used in the ceramic enamelling or glass industry; glass frit and powder, granules or flakes",26535.0,26535.0
3208,"Paints, varnishes; (enamels and lacquers) based on synthetic polymers or chemically modified natural polymers, dispersed or dissolved in a non-aqueous medium",1028214.84,1028214.84
3209,"Paints and varnishes (including enamels and lacquers) based on synthetic or chemically modified natural polymers, dispersed or dissolved in an aqueous medium",102275.11,102275.11
3210,"Paints and varnishes (including enamels, lacquers and distempers), excluding those of heading no. 3209, prepared water pigments of a kind used for finishing leather",61815.83,61815.83
3214,"Glaziers' putty, grafting putty, resin cements, caulking compounds and other mastics; painters' fillings; non-refractory surfacing preparations for facades, indoor walls, floors, ceilings or the like",74038.35,74038.35
3215,"Ink; printing, writing or drawing ink and other inks; whether or not concentrated or solid",22193.0,22193.0
3301,"Oils; essential (concretes, absolutes); concentrates thereof in fats, fixed oils, waxes or the like (obtained by enfleurage or maceration); aqueous distillates, solutions and terpenic by-products ther",15873.46,15873.46
3302,"Odoriferous substances and mixtures (including alcoholic solutions) with a basis of one or more of these substances, of a kind used as raw materials in industry; other preparations based on odoriferou",429155.75,429155.75
3303,Perfumes and toilet waters,3435286.2699999996,3435286.2699999996
3304,"Cosmetic and toilet preparations; beauty, make-up and skin care preparations (excluding medicaments, including sunscreen or sun tan preparations), manicure or pedicure preparations",6062013.42,6062013.42
3305,Hair preparations; for use on the hair,1373691.3900000001,1373691.3900000001
3306,"Oral or dental hygiene preparations; including fixative pastes and powders; yarn used to clean between the teeth (dental floss), in individual retail packages",2739198.8400000003,2739198.8400000003
3307,"Perfumery, cosmetic or toilet preparations; pre-shave, shaving, after-shave, bath preparations; personal deodorants and depilatories; room deodorisers, perfumed or not with disinfectant properties or ",373914.94,373914.94
3401,"Soap; organic surface-active preparations used as soap, skin washing, in bars, cakes, moulded pieces, shapes, liquid or cream, containing soap or not; for retail, paper, wadding, felt and nonwovens, i",14178348.64,14178348.64
3402,"Organic surface-active agents (not soap); surface-active, washing (including auxiliary washing) and cleaning preparations, containing soap or not, excluding those of heading no. 3401",536521.04,536521.04
3403,Lubricating preparations and those used in oil or grease treatment of textile and similar materials; excluding preparations containing 70% or more (by weight) of petroleum or bituminous mineral oils,41816.05,41816.05
3405,"Polishes, creams, scouring pastes, powders and similar; in any form, (including articles impregnated, coated or covered with such), for furniture, footwear, floors, coachwork, glass or metal",183395.7,183395.7
3406,"Candles, tapers and the like",873314.17,873314.17
3504,"Peptones and their derivatives; other protein substances and their derivatives n.e.c. or included; hide powder, whether or not chromed",486797.94999999995,486797.94999999995
3506,"Prepared glues and other prepared adhesives, n.e.c. or included; products suitable for use as glues or adhesives, put up for retail sale as glues or adhesives, not exceeding 1kg net weight",1024297.78,1024297.78
3507,Enzymes; prepared enzymes not elsewhere specified or included,28256.940000000002,28256.940000000002
3605,Matches; other than pyrotechnic articles of heading no. 3604,1151569.12,1151569.12
3808,"Insecticides, rodenticides, fungicides, herbicides, anti-sprouting products, plant growth regulators, disinfectants and the like, put up in forms or packings for retail sale or as preparations or arti",6616489.529999999,6616489.529999999
3814,"Organic composite solvents and thinners, not elsewhere specified or included; prepared paint or varnish removers",285492.0,285492.0
3816,"Refractory cements, mortars, concretes and similar compositions; other than products of heading no. 3801",1202903.57,1202903.57
3819,"Hydraulic brake fluids and other prepared liquids for hydraulic transmission, not containing or containing less than 70% by weight of petroleum oils or oils obtained from bituminous minerals",172315.0,172315.0
3822,"Reagents; diagnostic or laboratory reagents on a backing and prepared diagnostic or laboratory reagents whether or not on a backing, other than those of heading no. 3002 or 3006; certified reference m",47489.42,47489.42
3824,"Prepared binders for foundry moulds or cores; chemical products and preparations of the chemical or allied industries (including those consisting of mixtures of natural products), not elsewhere specif",37156427.28,37156427.28
3901,"Polymers of ethylene, in primary forms",13899918.96,13899918.96
3903,"Polymers of styrene, in primary forms",159840.0,159840.0
3904,"Polymers of vinyl chloride or of other halogenated olefins, in primary forms",761012.02,761012.02
3906,Acrylic polymers in primary forms,103749.0,103749.0
3907,"Polyacetals, other polyethers and epoxide resins, in primary forms; polycarbonates, alkyd resins, polyallyl esters and other polyesters, in primary forms",120726.5,120726.5
3910,Silicones in primary forms,15.0,15.0
3911,"Petroleum resins, coumarone-indene resins, polyterpenes, polysulphides, polysulphones and similar products of chemical synthesis n.e.c. in chapter 39, in primary forms",881123.3,881123.3
3912,"Cellulose and its chemical derivatives, n.e.c. or included, in primary forms",238356.76,238356.76
3917,"Tubes, pipes and hoses and fittings thereof (for example, joints, elbows, flanges), of plastics",1264802.5299999998,1264802.5299999998
3920,"Plastics; plates, sheets, film, foil and strip (not self-adhesive); non-cellular and not reinforced, laminated, supported or similarly combined with other materials, n.e.c. in chapter 39",393.0,393.0
3921,"Plastic plates, sheets, film, foil and strip n.e.c. in chapter 39",1803.03,1803.03
3923,"Plastic articles for the conveyance or packing of goods; stoppers, lids, caps and other closures of plastics",8358780.25,8358780.25
3924,"Tableware, kitchenware, other household articles and hygienic or toilet articles, of plastics",373749.3,373749.3
3926,"Articles of plastics and articles of other materials of heading no. 3901 to 3914, n.e.c. in chapter 39",3211745.91,3211745.91
4008,"Plates, sheets, strip, rods and profile shapes, of vulcanised rubber other than hard rubber",113442.16,113442.16
4011,"New pneumatic tyres, of rubber",11580667.56,11580667.56
4012,"Retreaded or used pneumatic tyres of rubber; solid or cushion tyres, tyre treads and tyre flaps, of rubber",38141.8,38141.8
4013,"Inner tubes, of rubber",17213.7,17213.7
4014,"Hygienic or pharmaceutical articles (including teats), of vulcanised rubber other than hard rubber, with or without fittings of hard rubber",52614.0,52614.0
4015,"Articles of apparel and clothing accessories (including gloves, mittens and mitts), for all purposes, of vulcanised rubber other than hard rubber",28261.0,28261.0
4016,"Articles of vulcanised rubber other than hard rubber, n.e.c. in chapter 40",175330.26,175330.26
4202,"Trunks; suit, camera, jewellery, cutlery cases; travel, tool, similar bags; wholly or mainly covered by leather, composition leather, plastic sheeting, textile materials, vulcanised fibre, paperboard",1015368.61,1015368.61
4203,"Articles of apparel and clothing accessories, of leather or of composition leather",124063.75,124063.75
4407,"Wood sawn or chipped lengthwise, sliced or peeled, whether or not planed, sanded or end-jointed, of a thickness exceeding 6mm",26633403.860000003,26633403.860000003
4411,"Fibreboard of wood or other ligneous materials, whether or not bonded with resins or other organic substances",3159450.98,3159450.98
4412,"Plywood, veneered panels and similar laminated wood",14095371.29,14095371.29
4416,"Casks, barrels, vats, tubs and other coopers' products and parts thereof, of wood, including staves",27541.0,27541.0
4416,"Meat, fish or crustaceans, molluscs or other aquatic invertebrates; preparations thereof",13016.0,13016.0
4418,"Builders' joinery and carpentry of wood, including cellular wood panels, assembled flooring panels, shingles and shakes",1764973.4100000001,1764973.4100000001
4420,"Wood marquetry and inlaid wood; caskets and cases for jewellery or cutlery, and similar articles of wood; statuettes and other ornaments of wood; wooden articles of furniture not falling in chapter 94",267044.99,267044.99
4421,Wooden articles n.e.c. in heading no. 4414 to 4420,807920.1,807920.1
4504,Agglomerated cork (with or without a binding substance) and articles of agglomerated cork,40521.0,40521.0
4802,"Uncoated paper and paperboard, used for writing, printing or other graphics, non perforated punch-cards and punch tape paper, in rolls or rectangular sheets, of any size, other than paper of heading 4",836682.8300000001,836682.8300000001
4804,"Uncoated kraft paper and paperboard, in rolls or sheets, other than that of heading no. 4802 or 4803",132127.72,132127.72
4809,"Carbon paper, self copy paper, and other copying or transfer papers (including coated or impregnated paper for duplicator stencils or offset plates), whether or not printed, in rolls or sheets",6978673.12,6978673.12
4811,"Paper, paperboard, cellulose wadding and webs of cellulose fibres, coated, impregnated, covered, surface-coloured, decorated or printed, rolls or sheets, other than goods of heading no. 4803, 4809, or",28470.0,28470.0
4812,"Filter blocks, slabs and plates of paper pulp",129282.79999999999,129282.79999999999
4813,"Cigarette paper, whether or not cut to size or in the form of booklets or tubes",106950.8,106950.8
4816,"Carbon paper, self-copy paper and other copying or transfer papers, (other than those of heading no. 4809), duplicator stencils and offset plates, of paper whether or not put up in boxes",187890.97,187890.97
