hs_code,hs_description,period_value,ytd_value
4817,"Envelopes, letter cards, plain postcards and correspondence cards, of paper, paperboard; boxes, pouches, wallets and writing compendiums, of paper or paperboard containing assortment of paper statione",391519.88,391519.88
4818,"Toilet paper, width 36cm or less or cut to size/shape; handkerchiefs, tissues, towels, serviettes, bed sheets and similar household or hospital articles, apparel and clothing accessories of paper pulp",2156629.66,2156629.66
4819,"Cartons, boxes, cases, bags and the like, of paper, paperboard, cellulose wadding or fibres; box files, letter trays and the like, of paper or paperboard, of a kind used in offices, shops or the like",5100649.01,5100649.01
4820,"Registers, account books, diaries and similar; albums for samples or collections, of paper or paperboard",2947717.13,2947717.13
4821,"Paper or paperboard labels of all kinds, whether or not printed",2378.95,2378.95
4823,"Paper, paperboard, cellulose wadding and webs of cellulose fibres; cut to size or shape, articles of paper pulp, paper and paper-board, cellulose wadding or webs of cellulose fibres, n.e.c. in chapter",300007.13999999996,300007.13999999996
4901,Animals; live,133442.0,133442.0
4901,"Printed books, brochures, leaflets and similar printed matter, whether or not in single sheets",650511.77,650511.77
4902,"Newspapers, journals and periodicals, whether or not illustrated or containing advertising material",220561.19,220561.19
4910,"Calendars of any kind, printed, including calendar blocks",78.0,78.0
4911,"Printed matter, n.e.c., including printed pictures and photographs",130664.73,130664.73
5204,"Cotton sewing thread, whether or not put up for retail sale",336301.45999999996,336301.45999999996
5401,"Sewing thread of man-made filaments, whether or not put up for retail sale",420444.43,420444.43
5402,"Synthetic filament yarn (other than sewing thread), not put up for retail sale, including synthetic monofilament of less than 67 decitex",678419.38,678419.38
5503,"Synthetic staple fibres, not carded, combed or otherwise processed for spinning",147452.41999999998,147452.41999999998
5603,"Nonwovens; whether or not impregnated, coated, covered or laminated",13143273.85,13143273.85
5607,"Twine, cordage, ropes and cables, whether or not plaited or braided; whether or not impregnated, coated, covered or sheathed with rubber or plastics",120369.0,120369.0
5608,"Twine, cordage or rope; knotted netting, made up fishing nets and other made up nets, of textile materials",66728.1,66728.1
5806,"Fabrics; narrow woven, other than goods of heading no. 5807; narrow fabrics consisting of warp without weft assembled by means of an adhesive (bolducs)",9195.0,9195.0
5810,"Embroidery; in the piece, in strips or in motifs",3063.75,3063.75
5903,"Fish and crustaceans, molluscs and other aquatic invertebrates",45842.3,45842.3
6302,"Bed linen, table linen, toilet linen and kitchen linen",44927.79,44927.79
6303,Curtains (including drapes) and interior blinds; curtain or bed valances,204485.0,204485.0
6305,"Sacks and bags, of a kind used for the packing of goods",1910075.2,1910075.2
6307,"Textiles; made up articles n.e.c. in chapter 63, including dress patterns",8.0,8.0
6309,Textiles; worn clothing and other worn articles,36760555.12,36760555.12
6403,"Footwear; with outer soles of rubber, plastics, leather or composition leather and uppers of leather",1932977.06,1932977.06
6404,"Dairy produce; birds' eggs; natural honey; edible products of animal origin, not elsewhere specified or included",635.0,635.0
6405,Footwear; other footwear n.e.c. in chapter 64,8922836.05,8922836.05
6505,"Hats and other headgear; knitted or crocheted, or made up from lace, felt or other textile fabric, in the piece (but not in strips), whether or not lined or trimmed; hair-nets of any material, whether",43230.0,43230.0
6601,"Umbrellas; sun umbrellas (including walking stick umbrellas, garden umbrellas and similar umbrellas)",27689.65,27689.65
6702,"Flowers, foliage and fruit, artificial, and parts thereof; articles made of artificial flowers, foliage or fruit",6184.0,6184.0
6704,"Wigs, false beards, eyebrows and eyelashes, switches and the like, of human or animal hair or of textile materials; articles of human hair, n.e.c. or included",3980428.65,3980428.65
6802,"Monumental or building stone, worked (except slate) and articles thereof (not of heading no. 6801) mosaic cubes etc., of natural stone including slate; artificially coloured granules of natural stone",289330.0,289330.0
6805,"Abrasive powder or grain; natural or artificial, on a base of textile material, of paper, paperboard or of other material, whether or not cut to shape or sewn or otherwise made up",59816.0,59816.0
6809,Plaster or compositions based on plaster; articles thereof,18983.45,18983.45
6810,"Cement, concrete or artificial stone; whether or not reinforced, articles thereof",85112.58,85112.58
6811,"Asbestos-cement, of cellulose fibre-cement or the like",1496733.6400000001,1496733.6400000001
6901,"Bricks, blocks, tiles and other ceramic goods of siliceous fossil meals (e.g. kieselguhr, tripolite or diatomite) or of similar siliceous earths",49261691.94,49261691.94
6905,"Roofing tiles, chimney-pots, cowls, chimney liners, architectural ornaments and other ceramic constructional goods",145463.38,145463.38
6910,"Ceramic sinks, wash basins, wash basin pedestals, baths, bidets, water closet pans, flushing cisterns, urinals and similar sanitary fixtures",178003.0,178003.0
6911,"Tableware, kitchenware, other household articles and toilet articles; of porcelain or china",48438.0,48438.0
6912,"Ceramic tableware, kitchenware, other household articles and toilet articles; other than of porcelain or china",10692.0,10692.0
6914,Ceramic articles; n.e.c. in chapter 69,62070.0,62070.0
7002,"Glass in balls (other than microspheres of heading no. 7018), rods or tubes, unworked",25038.0,25038.0
7007,"Safety glass, consisting of toughened (tempered) or laminated glass",91.0,91.0
7009,"Glass mirrors; whether or not framed, including rear-view mirrors",30239.2,30239.2
7010,"Carboys, bottles, flasks, jars, pots, phials, ampoules, containers of glass of a kind used for the conveyance or packing of goods; preserving jars of glass; stoppers, lids and other closures of glass",10174117.75,10174117.75
7013,"Glassware of a kind used for table, kitchen, toilet, office, indoor decoration or similar purposes (other than of heading no. 7010 or 7018)",23545.68,23545.68
7016,"Glass; paving blocks, slabs, bricks, tiles etc, of pressed, moulded glass, whether or not wired, glass smallwares for decorative purposes leaded lights and the like; multicellular or foam glass",1943556.03,1943556.03
7020,Glass; articles n.e.c. in chapter 70,85645.23999999999,85645.23999999999
7206,Iron and non-alloy steel in ingots or other primary forms (excluding iron of heading no. 7203),1150105.91,1150105.91
7210,"Iron or non-alloy steel; flat-rolled products, width 600mm or more, clad, plated or coated",632505.0,632505.0
7214,"Iron or non-alloy steel; bars and rods, not further worked than forged, hot-rolled, hot drawn or hot-extruded, but including those twisted after rolling",45741522.31,45741522.31
7216,"Iron or non-alloy steel, angles, shapes and sections",1087940.0,1087940.0
7217,Wire of iron or non-alloy steel,3600288.0,3600288.0
7219,Stainless steel; flat-rolled products of width of 600mm or more,9933.6,9933.6
7220,Stainless steel; flat-rolled products of width less than 600mm,619173.98,619173.98
7225,"Alloy steel flat-rolled products, of a width 600mm or more",6725946.02,6725946.02
7228,"Alloy steel bars, rods, shapes and sections; hollow drill bars and rods, of alloy or non-alloy steel",3295456.26,3295456.26
7303,"Tubes, pipes and hollow profiles, of cast iron",5927.08,5927.08
7307,"Tube or pipe fittings (e.g. couplings, elbows, sleeves), of iron or steel",388238.5,388238.5
7308,"Structures of iron or steel and parts thereof; plates, rods, angles, shapes, sections, tubes and the like, prepared for use in structures",19117662.18,19117662.18
7309,"Reservoirs, tanks, vats and similar containers; for any material (excluding compressed or liquefied gas), of iron or steel, capacity exceeding 300l, whether or not lined or heat insulated",118405.20999999999,118405.20999999999
7310,"Tanks, casks, drums, cans, boxes and similar containers, for any material (excluding compressed or liquefied gas), of iron or steel, capacity not exceeding 300l, whether or not lined or heat-insulated",78812.83,78812.83
7311,"Containers for compressed or liquefied gas, of iron or steel",2512300.3499999996,2512300.3499999996
7312,"Stranded wire, ropes, cables, plaited bands, slings and the like, of iron or steel, not electrically insulated",6983291.4799999995,6983291.4799999995
7313,"Barbed wire of iron or steel; twisted hoop or single flat wire, barbed or not and loosely twisted double wire, of a kind used for fencing, of iron or steel",1012619.72,1012619.72
7314,"Cloth (including endless bands), grill, netting and fencing, of iron or steel wire; expanded metal of iron or steel",451900.24,451900.24
7317,"Nails, tacks, drawing pins, corrugated nails, staples (not those of heading no. 8305) and the like, of iron or steel, with heads of other material or not, but excluding articles with heads of copper",5465646.55,5465646.55
7318,"Screws, bolts, nuts, coach screws, screw hooks, rivets, cotters, cotter-pins, washers (including spring washers) and similar articles, of iron or steel",67093.43,67093.43
7321,"Stoves, ranges, grates, cookers (those with subsidiary boilers for central heating), barbecues, braziers, gas-rings, plate warmers and similar non-electric domestic appliances and parts, of iron or st",2296975.51,2296975.51
7323,"Table, kitchen, other household articles and parts, of iron or steel; iron or steel wool; pot scourers and scouring or polishing pads, gloves and the like, of iron or steel",252135.84000000003,252135.84000000003
7324,"Sanitary ware and parts thereof, of iron or steel",70158.0,70158.0
7325,Iron or steel; cast articles,16940.0,16940.0
7326,"Iron or steel; articles, n.e.c. in chapter 73",12341755.259999998,12341755.259999998
7326,"Ores, slag and ash",26551.92,26551.92
7412,"Oil seeds and oleaginous fruits; miscellaneous grains, seeds and fruit, industrial or medicinal plants; straw and fodder",18810.0,18810.0
7604,"Aluminium; bars, rods and profiles",470945.75,470945.75
7607,"Aluminium foil (whether or not printed or backed with paper, paperboard, plastics or similar backing materials) of a thickness (excluding any backing) not exceeding 0.2mm",133086.3,133086.3
7609,"Aluminium; tube or pipe fittings (e.g. couplings, elbows, sleeves)",24400.0,24400.0
7610,"Aluminium; structures (excluding prefabricated buildings of heading no. 9406) and parts (e.g. bridges and sections, towers, lattice masts, etc) plates, rods, profiles and tubes for structures",512238.04,512238.04
7612,"Aluminium casks, drums, cans, boxes etc (including rigid, collapsible tubular containers), for materials other than compressed, liquefied gas, 300l capacity or less, lined, heat-insulated or not",409413.66,409413.66
7616,Aluminium; articles n.e.c. in chapter 76,12751.2,12751.2
8112,"Beryllium, chromium, germanium, vanadium, gallium, hafnium, indium, niobium (columbium), rhenium and thallium; and articles of these metals, including waste and scrap",83561.0,83561.0
8201,"Tools, hand; spades, shovels, mattocks, picks, hoes, forks, rakes; axes, bill hooks etc; secateurs and pruners of any kind; scythes, sickles, hay knives, hedge shears, timber wedges and other tools us",554461.01,554461.01
8203,"Tools, hand; files, rasps, pliers (including cutting pliers), pincers, tweezers, metal cutting shears, pipe cutters, bolt croppers, perforating punches and similar",30173.3,30173.3
8204,"Tools, hand; hand-operated spanners and wrenches (including torque meter wrenches but not including tap wrenches), interchangeable spanner sockets, with or without handles",1344275.99,1344275.99
8206,"Tools, hand; two or more of heading no. 8202 to 8205, put up in sets for retail sale",441.0,441.0
8212,Razors and razor blades; (including razor blade blanks in strips),193845.0,193845.0
8213,"Scissors; tailors' shears and similar shears, and blades therefore",0.0,0.0
8215,"Cutlery; spoons, forks, ladles, skimmers, cake-servers, fish-knives, butter knives, sugar tongs and similar kitchen or tableware",51957.2,51957.2
8301,"Padlocks and locks (key, combination, electrically operated) of base metal; clasps and frames with clasps incorporating locks, of base metal, keys for any or the foregoing articles, of base metal",451709.31000000006,451709.31000000006
8302,"Base metal mountings, fittings and similar articles for furniture, doors, staircases, windows, trunks, chests etc, castors with mountings of base metal, automatic door closers of base metal",59310.0,59310.0
8303,"Safes; armoured or reinforced, strong-boxes, doors and safe deposit lockers for strong-rooms, cash or deed boxes and the like, of base metal",10554.14,10554.14
8304,"Office equipment; filing cabinets, card-index cabinets, paper trays and rests, pen trays, office-stamp stands and the like, of base metal, other than office furniture of heading no. 9403",72784.0,72784.0
8404,"Auxiliary plant for use with boilers of heading no. 8402 or 8403; e.g. economisers, super-heaters, soot removers, gas recoverers), condensers for steam or other vapour power units",25276.05,25276.05
8407,Reciprocating or rotary internal combustion piston engines,224260.31000000003,224260.31000000003
8407,Vegetables and certain roots and tubers; edible,95.0,95.0
8412,"Engines and motors; n.e.c. (e.g. reaction engines, hydraulic power engines, pneumatic power engines)",18661.0,18661.0
8413,"Pumps; for liquids, whether or not fitted with measuring device, liquid elevators",111321.01000000001,111321.01000000001
8414,"Air or vacuum pumps, air or other gas compressors and fans; ventilating or recycling hoods incorporating a fan whether or not fitted with filters",1073767.9399999997,1073767.9399999997
8414,Vegetable plaiting materials; vegetable products not elsewhere specified or included,6790.0,6790.0
8415,"Air conditioning machines; comprising a motor driven fan and elements for changing the temperature and humidity, including those machines in which the humidity cannot be separately regulated",717625.97,717625.97
8417,"Furnaces and ovens; industrial or laboratory, including incinerators, non-electric",29840.0,29840.0
8418,"Refrigerators, freezers and other refrigerating or freezing equipment, electric or other; heat pumps other than air conditioning machines of heading no. 8415",3543174.25,3543174.25
8419,"Machinery, plant (not domestic), or laboratory equipment; electrically heated or not, (excluding items in 85.14) for the treatment of materials by a process involving change of temperature; including ",19486.0,19486.0
8419,"Preparations of cereals, flour, starch or milk; pastrycooks' products",84254.98999999999,84254.98999999999
8421,"Centrifuges, including centrifugal dryers; filtering or purifying machinery and apparatus for liquids or gases",463490.76,463490.76
8422,"Dish washing machines; machinery for cleaning, drying, filling, closing, sealing, capsuling or labelling bottles, cans, boxes, bags, etc, machinery for aerating beverages",150065.7,150065.7
8424,"Mechanical appliances for projecting, dispersing or spraying liquids or powders; fire extinguishers, spray guns, steam, sand blasting machines",101897.5,101897.5
8426,"Derricks, cranes, including cable cranes, mobile lifting frames, straddle carriers and works trucks fitted with a crane",173076.14,173076.14
8428,"Lifting, handling, loading or unloading machinery; n.e.c. in heading no. 8425, 8426 or 8427 (e.g. lifts, escalators, conveyors, teleferics)",236378.5,236378.5
8429,"Bulldozers, graders, levellers, scrapers, angledozers, mechanical shovels, excavators, shovel loaders, tamping machines and road rollers, self-propelled",319909.65,319909.65
8430,Pharmaceutical products,30056.0,30056.0
8433,"Harvesting and threshing machinery, straw and fodder balers, grass or hay mowers; machines for cleaning, sorting or grading eggs, fruit or other agricultural produce, other than machinery of heading n",44002.0,44002.0
8435,"Presses, crushers and similar machinery; used in the manufacture of wine, cider, fruit juices or similar beverages",58125.45,58125.45
8436,"Agricultural, horticultural, forestry, poultry-keeping, bee-keeping machinery; including germination plant fitted with mechanical or thermal equipment; poultry incubators and brooders",177715.7,177715.7
8437,"Machines for cleaning, sorting, grading seed, grain, dried leguminous vegetables; machinery used in the milling industry for the working of cereals or dried leguminous vegetables, not farm type machin",49922.3,49922.3
8438,"Machinery n.e.c. in this chapter, for the industrial preparation or manufacture of food or drink; other than machinery for extraction or preparation of animal or fixed vegetable fats or oils",423921.58999999997,423921.58999999997
8441,"Machines; for making up paper pulp, paper or paperboard, including cutting machines of all kinds",1262003.79,1262003.79
8443,"Printing machinery; used for printing by means of plates, cylinders and other printing components of heading 84.42; other printers, copying machines and facsimile machines, whether or not combined; pa",111868.0,111868.0
8447,"Knitting machines, stitch-bonding machines and machines for making gimped yarn, tulle, lace, embroidery, trimmings, braid or net and machines for tufting",803268.0,803268.0
8450,Household or laundry-type washing machines; including machines which both wash and dry,335391.29000000004,335391.29000000004
8455,Metal-rolling mills and rolls therefor,3597071.28,3597071.28
8461,"Machine-tools; for planing, shaping, slotting, broaching, gear cutting and grinding, finishing, sawing, cutting off and other tools working by removing metal, sintered metal carbides or cermets n.e.c.",3304.6,3304.6
8468,"Machinery and apparatus for soldering, brazing, welding, whether or not capable of cutting, other than those of heading no. 8515; gas-operated surface tempering machines and appliances",12033.8,12033.8
8471,"Automatic data processing machines and units thereof, magnetic or optical readers, machines for transcribing data onto data media in coded form and machines for processing such data, not elsewhere spe",590.0,590.0
8471,"Natural, cultured pearls; precious, semi-precious stones; precious metals, metals clad with precious metal, and articles thereof; imitation jewellery; coin",203.0,203.0
8472,Office machines; not elsewhere classified,3331.0,3331.0
8473,"Machinery; parts and accessories (other than covers, carrying cases and the like) suitable for use solely or principally with machines of headings 84.70 to 84.72",77713.57,77713.57
8474,"Machinery for sorting, screening, separating, washing, crushing, grinding, mixing or kneading earth, stone, ores in solid form, shaping, moulding machinery for solid mineral fuels",183693.0,183693.0
8477,"Machinery; for working rubber or plastics or for the manufacture of products from these materials, n.e.c. in this chapter",45954.0,45954.0
8479,"Machinery and mechanical appliances; having individual functions, n.e.c. in this chapter",89867.43,89867.43
8480,"Moulding boxes for metal foundry, moulding patterns, moulds for metals (excluding ingot moulds), metal carbides, glass, mineral materials, rubber or plastics",1359501.06,1359501.06
8481,"Taps, cocks, valves and similar appliances for pipes, boiler shells, tanks, vats or the like, including pressure-reducing valves and thermostatically controlled valves",26.0,26.0
8487,"Machinery parts; not containing electrical connectors, insulators, coils, contacts or other electrical features, n.e.c. in this chapter",5269.46,5269.46
8502,Electric generating sets and rotary converters,2289152.0599999996,2289152.0599999996
8503,Electric motors and generators; parts suitable for use solely or principally with the machines of heading no. 8501 or 8502,32184.0,32184.0
8504,"Electric transformers, static converters (e.g. rectifiers) and inductors",306882.44,306882.44
8506,Cells and batteries; primary,7941089.26,7941089.26
8507,"Electric accumulators, including separators therefor; whether or not rectangular (including square)",18409.0,18409.0
8509,"Electro-mechanical domestic appliances; with self-contained electric motor, other than vacuum cleaners of heading 85.08.",771920.4299999999,771920.4299999999
8515,"Electric (electrically heated gas) soldering, brazing, welding machines and apparatus, capable or not of cutting, electric machines and apparatus for hot spraying of metals or sintered carbides",845298.5,845298.5
8516,"Electric water, space, soil heaters; electro-thermic hair-dressing apparatus; hand dryers, irons; electro-thermic appliances for domestic purposes; electro heating resistors, not of heading no. 8545",121850.88999999998,121850.88999999998
8517,Sugars and sugar confectionery,49500.0,49500.0
8517,"Telephone sets, including telephones for cellular networks or for other wireless networks; other apparatus for the transmission or reception of voice, images or other data (including wired/wireless ne",495270.82999999996,495270.82999999996
8518,"Microphones and their stands; loudspeakers, mounted or not in their enclosures; headphones and earphones, combined or not with a microphone, and sets of a microphone and one or more loudspeakers; audi",492749.36,492749.36
8523,"Discs, tapes, solid-state non-volatile storage devices, smart cards and other media for the recording of sound or of other phenomena, whether or not recorded, including matrices and masters for the pr",630724.2,630724.2
8525,"Transmission apparatus for radio-broadcasting or television, whether or not incorporating reception apparatus or sound recording or reproducing apparatus; television cameras, digital cameras and video",780.0,780.0
8528,"Inorganic chemicals; organic and inorganic compounds of precious metals; of rare earth metals, of radio-active elements and of isotopes",25795.0,25795.0
8528,"Monitors and projectors, not incorporating television reception apparatus; reception apparatus for television, whether or not incorporating radio-broadcast receivers or sound or video recording or rep",110201.02000000002,110201.02000000002
8529,Transmission apparatus; parts suitable for use solely or principally with the apparatus of heading no. 8525 to 8528,546054.44,546054.44
8536,"Electrical apparatus for switching, protecting electrical circuits, for making connections to or in electrical circuits, for a voltage not exceeding 1000 volts; connectors for optical fibres, optical ",404529.82999999996,404529.82999999996
8539,"Lamps; electric filament or discharge lamps, including sealed beam lamp units and ultra-violet or infra-red lamps, arc lamps, light-emitting diode (LED) lamps",29012.0,29012.0
8541,"Diodes, transistors, similar semiconductor devices; including photovoltaic cells assembled or not in modules or panels, light-emitting diodes (LED), mounted piezo-electric crystals",4940320.42,4940320.42
8542,Electronic integrated circuits,34300.9,34300.9
8544,"Insulated wire, cable and other electric conductors, connector fitted or not; optical fibre cables of individually sheathed fibres, whether or not assembled with electric conductors or fitted with con",602838.89,602838.89
8607,Vegetables and certain roots and tubers; edible,3360.0,3360.0
8609,Containers; (including containers for transport of fluids) specially designed and equipped for carriage by one or more modes of transport,234341.13,234341.13
8702,Vehicles; public transport passenger type,8734607.999999998,8734607.999999998
8703,"Motor cars and other motor vehicles; principally designed for the transport of persons (other than those of heading no. 8702), including station wagons and racing cars",7663713.059999999,7663713.059999999
8704,Vehicles; for the transport of goods,1709387.38,1709387.38
8705,"Special purpose motor vehicles; not those for the transport of persons or goods (e.g. breakdown lorries, road sweeper lorries, spraying lorries, mobile workshops, mobile radiological units etc)",52796.2,52796.2
8706,"Chassis; fitted with engines, for the motor vehicles of heading no. 8701 to 8705",412635.76,412635.76
8708,"Motor vehicles; parts and accessories, of heading no. 8701 to 8705",3269585.8,3269585.8
8710,"Tanks and other armoured fighting vehicles; motorised, whether or not fitted with weapons, and parts of such vehicles",438362.43000000005,438362.43000000005
8711,"Motorcycles (including mopeds) and cycles; fitted with an auxiliary motor, with or without side-cars; side-cars",14797768.31,14797768.31
8712,"Bicycles and other cycles; including delivery tricycles, not motorised",62657.8,62657.8
8714,Vehicles; parts and accessories of heading no. 8711 to 8713,7435422.2700000005,7435422.2700000005
8716,"Meat, fish or crustaceans, molluscs or other aquatic invertebrates; preparations thereof",5031.0,5031.0
8716,"Trailers and semi-trailers; other vehicles, not mechanically propelled; parts thereof",1352338.0899999999,1352338.0899999999
8803,"Fish and crustaceans, molluscs and other aquatic invertebrates",2149.0,2149.0
8903,"Yachts and other vessels; for pleasure or sports, rowing boats and canoes",13840.2,13840.2
8907,"Boats, floating structures, other (for e.g. rafts, tanks, coffer-dams, landing stages, buoys and beacons)",12839.59,12839.59
9001,"Optical fibres and optical fibre bundles; optical fibre cables not of heading no. 8544; sheets, plates of polarising material; lenses, prisms, mirrors, of any material; unmounted; not non optical glas",286609.74,286609.74
9004,"Spectacles, goggles and the like; corrective, protective or other",22822.5,22822.5
